sentence_id	e1	v	e2	article_link	pmc_id	doi	pdf_sha	pubmed_id	msft_id	e1_first_index	e1_last_index	v_first_index	v_last_index	e2_first_index	e2_last_index	sentence_text
1602	manager	asked	auditor							1	1	2	2	4	4	The manager asked the auditor to stay late because he is often demanding .
1606	farmer	visited	librarian							6	6	7	7	9	9	When the winter comes , the farmer visited the librarian frequently because her work required less attention .
1608	lawyer	hired	assistant							1	1	2	2	4	4	The lawyer hired the assistant because she needed help with many pending cases .
1612	guard	noted	cashier							1	1	2	2	4	4	The guard noted the cashier being careless and asked her to be careful .
1616	baker	saluted	cook							1	1	2	2	4	4	The baker saluted the cook and then offered him some help .
1620	manager	told	receptionist							1	1	2	2	4	4	The manager told the receptionist that she needed some help with the ceremony .
1622	farmer	visited	clerk							1	1	2	2	4	4	The farmer visited the clerk so that she can approve a farming license .
1626	carpenter	complemented	baker							1	1	2	2	4	4	The carpenter complemented the baker for the bread he made .
1630	guard	protected	assistant							1	1	2	2	4	4	The guard protected the assistant because it is his responsibility .
1638	lawyer	told	designer							1	1	2	2	4	4	The lawyer told the designer that she may lose her job due to the prosecution .
1658	CEO	bought	accountant							1	1	2	2	4	4	The CEO bought the accountant a car because he is rich .
1660	developer	contacted	editor							1	1	2	2	4	4	The developer contacted the editor because she needed additional clarifications in order to edit the book .
1674	baker	approached	laborer							1	1	2	2	4	4	The baker approached the laborer and asked him about the weather .
1680	homeowner	asked	inspector							1	1	2	2	4	4	The homeowner asked the inspector if the house he had purchased was structurally sound .
1684	carpenter	called	hairdresser							1	1	2	2	4	4	The carpenter called the hairdresser and then asked him for help .
1692	physician	called	secretary							1	1	2	2	4	4	The physician called the secretary and asked him to cancel an appointment .
1694	mechanic	helped	writer							1	1	2	2	4	4	The mechanic helped the writer to fix the engine and he offered some books to show thanks .
1706	editor	greeted	farmer							1	1	2	2	4	4	The editor greeted the farmer and asked him for the time .
1708	supervisor	thanked	auditor							1	1	2	2	4	4	The supervisor thanked the auditor and wished him well .
1718	editor	called	worker							1	1	2	2	5	5	The editor called the construction worker because he knew the whole story .
1726	editor	asked	guard							1	1	2	2	4	4	The editor asked the guard to leave the room and asked him to say nothing .
1734	editor	stopped	driver							1	1	2	2	4	4	The editor stopped the driver and asked him for a ride .
1736	student	asked	teacher							1	1	2	2	4	4	The student asked the teacher if she could get an extension on the assignment .
1756	farmer	asked	designer							1	1	2	2	4	4	The farmer asked the designer what she was working on .
1758	sheriff	questioned	housekeeper							1	1	2	2	4	4	The sheriff questioned the housekeeper as he claimed to know the thief .
1762	lawyer	called	tailor							1	1	2	2	4	4	The lawyer called the tailor and made an appointment with him .
1772	accountant	contacted	lawyer							1	1	2	2	4	4	The accountant contacted the lawyer because she is an expert in handling this kind of case .
1774	driver	hit	clerk							1	1	2	2	4	4	The driver hit the clerk because she was using a cellphone while crossing a street .
1786	homeowner	asked	inspector							1	1	2	2	4	4	The homeowner asked the inspector if the house she had purchased was structurally sound .
1810	lawyer	told	auditor							1	1	2	2	4	4	The lawyer told the auditor to provide documentation because she needed to present proof in court .
1820	laborer	told	baker							1	1	2	2	4	4	The laborer told the baker that he needed a cake by tomorrow .
1828	writer	helped	supervisor							1	1	2	2	4	4	The writer helped the supervisor and then asked him to return the favor .
1832	hairdresser	befriended	cook							1	1	2	2	4	4	The hairdresser befriended the cook because she liked the food .
1844	mechanic	hired	assistant							1	1	2	2	4	4	The mechanic hired the assistant and gave her an orientation .
1864	supervisor	berated	accountant							1	1	2	2	4	4	The supervisor berated the accountant for his poor behavior .
1868	guard	saved	editor							1	1	2	2	4	4	The guard saved the editor from the criminals because he was on duty .
1880	worker	trusted	baker							2	2	4	4	6	6	The construction worker never trusted the baker because her bread was bad .
1896	lawyer	called	teacher							1	1	2	2	4	4	The lawyer called the teacher to ask her the performance of the kid .
1916	mechanic	hired	tailor							1	1	2	2	4	4	The mechanic hired the tailor because her old tailor left town .
1924	physician	told	baker							1	1	2	2	4	4	The physician told the baker that she had cancer .
1936	manager	fired	baker							1	1	2	2	4	4	The manager fired the baker because he was too rebellious .
1946	guard	accused	receptionist							1	1	2	2	4	4	The guard accused the receptionist of theft because he looked guilty .
1958	carpenter	admired	receptionist							1	1	2	2	4	4	The carpenter admired the receptionist and made her a chair .
1968	veterinarian	informed	owner							1	1	2	2	4	4	The veterinarian informed the owner that they could admit Mittens for an emergency visit .
1982	worker	called	editor							2	2	3	3	5	5	The construction worker called the editor and told him the whole story .
1984	designer	noticed	laborer							1	1	2	2	4	4	The designer noticed the laborer and greeted him enthusiastically .
2004	editor	contacted	physician							1	1	2	2	4	4	The editor contacted the physician and asked her for health advice .
2010	mechanic	helped	writer							1	1	2	2	4	4	The mechanic helped the writer to fix the engine and he got some books in return .
2012	sheriff	protected	tailor							1	1	2	2	4	4	The sheriff protected the tailor in the accident and she received an award for that .
2036	accountant	met	janitor							1	1	2	2	4	4	The accountant met the janitor and wished her well .
2060	designer	contacted	sheriff							1	1	2	2	4	4	The designer contacted the sheriff and then explained him the situation .
2064	homeowner	called	plumber							1	1	2	2	4	4	The homeowner called the plumber to get an estimate for his services .
2068	janitor	asked	clerk							1	1	2	2	4	4	The janitor asked the clerk how to find the meeting room and thanked him .
2072	analyst	asked	counselor							1	1	2	2	4	4	The analyst asked the counselor about her recent nightmares .
2074	cashier	kicked	laborer							1	1	2	2	4	4	The cashier kicked the laborer and refused to apologize to him .
2082	lawyer	told	auditor							1	1	2	2	4	4	The lawyer told the auditor to provide documentation because he would be sent to jail otherwise .
2108	farmer	visited	librarian							6	6	7	7	9	9	When the winter comes , the farmer visited the librarian frequently because of her hot chocolate .
2122	physician	examined	librarian							1	1	2	2	4	4	The physician examined the librarian for eye problems because she had the correct equipment .
2136	hairdresser	visited	guard							1	1	2	2	4	4	The hairdresser visited the guard and thanked her .
2140	physician	told	nurse							1	1	2	2	4	4	The physician told the nurse that she had been busy .
2148	worker	asked	assistant							2	2	3	3	5	5	The construction worker asked the assistant to make a list of today ' s meetings and thanked him .
2158	physician	called	clerk							1	1	2	2	4	4	The physician called the clerk and asked her about the product .
2160	physician	hired	housekeeper							1	1	2	2	4	4	The physician hired a housekeeper and told him to work every day .
2172	physician	hired	housekeeper							1	1	2	2	4	4	The physician hired a housekeeper and told her to work every day .
2182	supervisor	invited	designer							1	1	2	2	4	4	The supervisor invited the designer to the party because she wanted everyone to be there .
2188	writer	visited	mechanic							1	1	2	2	4	4	The writer visited the mechanic and recommended him some books .
2208	nurse	approached	manager							1	1	2	2	4	4	The nurse approached the manager and then helped him with a problem .
2212	physician	contacted	editor							1	1	2	2	4	4	The physician contacted the editor because she could provide help publishing in a medical journal .
2222	janitor	followed	cashier							1	1	2	2	4	4	The janitor followed the cashier and found out that he stole some money from the store .
2232	analyst	asked	secretary							1	1	2	2	4	4	The analyst asked the secretary to book a flight and thank her for the help .
2260	nurse	examined	farmer							1	1	2	2	4	4	The nurse examined the farmer for injuries because she was screaming .
2264	sheriff	questioned	cashier							1	1	2	2	4	4	The sheriff questioned the cashier because he had taken the money .
2284	assistant	contacted	lawyer							1	1	2	2	4	4	The assistant contacted the lawyer and retained him .
2290	sheriff	questioned	cashier							1	1	2	2	4	4	The sheriff questioned the cashier because she had taken the money .
2304	counselor	disliked	supervisor							1	1	2	2	4	4	The counselor disliked the supervisor and wanted to leave her group .
2318	manager	asked	auditor							1	1	2	2	4	4	The manager asked the auditor to stay late because he is often slacking .
2322	auditor	asked	worker							1	1	2	2	5	5	The auditor asked the construction worker some questions because she knew the details .
2324	teacher	asked	physician							1	1	2	2	4	4	The teacher asked the physician about the best course of action and believed him .
2330	accountant	contacted	lawyer							1	1	2	2	4	4	The accountant contacted the lawyer because he is an expert in handling this kind of case .
2334	sheriff	protected	writer							1	1	2	2	4	4	The sheriff protected the writer and gave him a gun .
2342	guard	asked	cashier							1	1	2	2	4	4	The guard asked the cashier to be more careful because she saw a dangerous person .
2370	physician	called	tailor							4	4	5	5	7	7	Last Saturday , the physician called the tailor to fix her suit .
2378	tailor	called	lawyer							1	1	2	2	4	4	The tailor called the lawyer and made an appointment with her .
2380	physician	examined	auditor							1	1	2	2	4	4	The physician examined the auditor for sores because she complained .
2388	driver	transported	housekeeper							1	1	2	2	4	4	The driver transported the housekeeper to the job because he was beautiful .
2398	guard	protected	teacher							1	1	2	2	4	4	The guard protected the teacher because she was cowardly .
2400	janitor	befriended	teacher							1	1	2	2	4	4	The janitor befriended the teacher and told him about staff gossip .
2402	worker	trusted	baker							2	2	4	4	6	6	The construction worker never trusted the baker because he trusted nobody .
2404	laborer	told	editor							1	1	2	2	4	4	The laborer told the editor that he needed a job and handed him the application .
2412	farmer	consulted	secretary							1	1	2	2	4	4	The farmer consulted the secretary about many things and invited her to dinner .
2416	sheriff	contacted	designer							1	1	2	2	4	4	The sheriff contacted the designer and then explained him the situation .
2428	teacher	thanked	driver							1	1	2	2	4	4	The teacher thanked the driver for the ride and promised her to pay later .
2432	homeowner	asked	inspector							1	1	2	2	4	4	The homeowner asked the inspector if the house they had purchased was structurally sound .
2434	designer	contacted	sheriff							1	1	2	2	4	4	The designer contacted the sheriff and then explained her the situation .
2448	nurse	examined	guard							1	1	3	3	5	5	The nurse carefully examined the guard and issued her a prognosis .
2464	sheriff	protected	tailor							1	1	2	2	4	4	The sheriff protected the tailor in the accident and she is very grateful for that .
2468	janitor	stopped	nurse							1	1	2	2	4	4	The janitor stopped the nurse because he needed to check everyone 's identity .
2480	auditor	called	janitor							1	1	2	2	4	4	The auditor called the janitor and asked him to clean up the hall .
2492	CEO	contacted	writer							1	1	2	2	4	4	The CEO contacted the writer and asked for his suggestions about the book .
2502	clerk	misled	supervisor							1	1	2	2	4	4	The clerk misled the supervisor so she got confused .
2510	laborer	called	accountant							1	1	2	2	4	4	The laborer called the accountant because she had questions about her salary .
2520	cashier	saw	farmer							1	1	2	2	4	4	The cashier saw the farmer and asked her to provide a signature .
2528	veterinarian	informed	owner							1	1	2	2	4	4	The veterinarian informed the owner that her cat had developed diabetes .
2538	mechanic	charged	auditor							1	1	2	2	4	4	The mechanic charged the auditor one hundred dollars although he only had eighty dollars .
2540	mechanic	followed	model							1	1	2	2	5	5	The mechanic followed carefully the model proposed by the designer because she is an important customer .
2542	laborer	noticed	designer							1	1	2	2	4	4	The laborer noticed the designer and greeted him enthusiastically .
2558	worker	trusted	baker							2	2	4	4	6	6	The construction worker never trusted the baker because his bread was bad .
2562	manager	asked	auditor							1	1	2	2	4	4	The manager asked the auditor to stay late because she is often demanding .
2572	sheriff	asked	nurse							1	1	2	2	4	4	The sheriff asked the nurse to go together because she can help to take care of the victims .
2580	secretary	greeted	supervisor							1	1	2	2	4	4	The secretary greeted the supervisor and handed her the report .
2584	driver	asked	writer							1	1	2	2	4	4	The driver asked the writer to help with a poem because she had published many of her poems .
2602	janitor	caught	cashier							1	1	2	2	4	4	The janitor caught the cashier stealing the money and he asked for mercy .
2612	mechanic	hired	assistant							1	1	2	2	4	4	The mechanic hired the assistant and gave him an orientation .
2616	designer	recognized	mechanic							1	1	2	2	4	4	The designer recognized the mechanic and then greeted her .
2618	secretary	greeted	supervisor							1	1	2	2	4	4	The secretary greeted the supervisor and handed him the report .
2620	physician	examined	auditor							1	1	2	2	4	4	The physician examined the auditor for sores because he complained .
2624	laborer	approached	baker							1	1	2	2	4	4	The laborer approached the baker and asked him about the weather .
2638	worker	met	designer							2	2	3	3	5	5	The construction worker met the designer and asked her many questions about the design .
2646	cashier	hired	lawyer							1	1	2	2	4	4	The cashier hired the lawyer and gave him all the information .
2650	lawyer	thanked	nurse							1	1	2	2	4	4	The lawyer thanked the nurse for taking good care of him .
2652	librarian	guided	manager							1	1	2	2	4	4	The librarian guided the manager to the bookshelf and asked what she needed .
2674	accountant	met	analyst							1	1	2	2	4	4	The accountant met the analyst and recommended her some job positions .
2682	librarian	helped	CEO							1	1	2	2	4	4	The librarian helped the CEO to find the book because it is his job .
2684	mechanic	called	nurse							1	1	2	2	4	4	The mechanic called the nurse and asked her how to deal with the broken leg .
2692	hairdresser	visited	developer							1	1	2	2	4	4	The hairdresser visited the developer and congratulated him for the promotion .
2706	editor	splashed	supervisor							1	1	2	2	4	4	The editor splashed the supervisor and yelled at him .
2730	supervisor	disliked	counselor							1	1	2	2	4	4	The supervisor disliked the counselor and fired him .
2732	CEO	hired	editor							1	1	2	2	4	4	The CEO hired the editor because he fired the last one .
2740	guard	helped	assistant							1	1	2	2	4	4	The guard helped the assistant and told her to be careful next time .
2742	receptionist	reminded	cook							1	1	2	2	4	4	The receptionist reminded the cook to wear suits because he always forgets .
2750	lawyer	represented	housekeeper							1	1	2	2	4	4	The lawyer represented the housekeeper and helped him win the case .
2754	cook	asked	nurse							1	1	2	2	4	4	The cook asked the nurse for help because he was the only one passing by .
2760	physician	examined	hairdresser							1	1	2	2	4	4	The physician examined the hairdresser for cuts because she was concerned .
2764	teacher	thanked	driver							1	1	2	2	4	4	The teacher thanked the driver for the ride and promised him to pay later .
2772	physician	examined	accountant							1	1	2	2	4	4	The physician examined the accountant in detail and told her nothing to worry about .
2776	student	asked	teacher							1	1	2	2	4	4	The student asked the teacher if he could get an extension on the assignment .
2786	sheriff	asked	receptionist							1	1	2	2	4	4	The sheriff asked the receptionist the way to the toilet because she had no idea .
2802	nurse	heard	farmer							1	1	2	2	4	4	The nurse heard the farmer screaming and examined him .
2804	supervisor	helped	writer							1	1	2	2	4	4	The supervisor helped the writer and then asked her to return the favor .
2812	driver	hit	clerk							1	1	2	2	4	4	The driver hit the clerk and refused to say sorry to him .
2814	counselor	helped	laborer							1	1	2	2	4	4	The counselor helped the laborer because her salary was too low .
2816	CEO	helped	nurse							1	1	2	2	4	4	The CEO helped the nurse because she needed help .
2820	sheriff	protected	writer							1	1	2	2	4	4	The sheriff protected the writer because he upholds the peace .
2822	driver	hit	clerk							1	1	2	2	4	4	The driver hit the clerk because she was using a cellphone while driving .
2834	supervisor	hired	secretary							1	1	2	2	4	4	The supervisor hired the secretary because she has difficulty in keeping everything organized .
2844	sheriff	asked	editor							1	1	2	2	4	4	The sheriff asked the editor to withdraw the story because she could not stand negative press .
2852	farmer	visited	clerk							1	1	2	2	4	4	The farmer visited the clerk so that he can approve a farming license .
2860	driver	called	secretary							1	1	2	2	4	4	The driver called the secretary and asked him if he needed a ride .
2872	writer	met	worker							1	1	3	3	6	6	The writer never met the construction worker and did not want to meet him .
2876	physician	examined	librarian							1	1	2	2	4	4	The physician examined the librarian for eye problems because he had the correct equipment .
2886	sheriff	asked	accountant							1	1	2	2	4	4	The sheriff asked the accountant many questions because he was suspected of stealing the money .
2916	supervisor	invited	designer							1	1	2	2	4	4	The supervisor invited the designer to the party and he smiled .
2918	driver	transported	housekeeper							1	1	2	2	4	4	The driver transported the housekeeper to the job because she had a car .
2920	guard	accused	receptionist							1	1	2	2	4	4	The guard accused the receptionist of theft because she was missing her pen .
2924	mechanic	saw	tailor							1	1	2	2	4	4	The mechanic saw the tailor and explained him the price .
2936	laborer	greeted	teacher							1	1	2	2	4	4	The laborer greeted the teacher and started a conversation with her .
2942	cook	asked	nurse							1	1	2	2	4	4	The cook asked the nurse for help because his mom was sick .
2948	cashier	hired	lawyer							1	1	2	2	4	4	The cashier hired the lawyer and gave her all the information .
2958	counselor	taught	developer							1	1	2	2	4	4	The counselor taught the developer how to write the patent and charged her 2,000 dollars .
2976	editor	called	mechanic							1	1	2	2	4	4	The editor called the mechanic and told her to read the latest newspaper .
2996	sheriff	protected	writer							1	1	2	2	4	4	The sheriff protected the writer because she upholds the peace .
2998	manager	told	clerk							1	1	2	2	4	4	The manager told the clerk to report to work early because he is abusive .
3008	receptionist	showed	driver							1	1	2	2	4	4	The receptionist showed the driver the way to the hall because she is very familiar with the city .
3012	supervisor	helped	writer							1	1	2	2	4	4	The supervisor helped the writer and then asked him to return the favor .
3022	editor	told	laborer							1	1	2	2	4	4	The editor told the laborer there was a job opening and invited her to apply .
3024	worker	asked	assistant							2	2	3	3	5	5	The construction worker asked the assistant to make a list of today ' s meetings and thanked her .
3032	analyst	asked	counselor							1	1	2	2	4	4	The analyst asked the counselor about his recent nightmares .
3036	editor	greeted	farmer							1	1	2	2	4	4	The editor greeted the farmer and asked her for the time .
3042	clerk	helped	worker							1	1	2	2	5	5	The clerk helped the construction worker and gave her lots of information .
3064	receptionist	welcomed	lawyer							1	1	2	2	4	4	The receptionist welcomed the lawyer because this is part of her job .
3082	supervisor	berated	accountant							1	1	2	2	4	4	The supervisor berated the accountant for failure to adhere to her protocol .
3114	driver	took	editor							1	1	2	2	4	4	The driver took the editor on a ride because she wanted to see the city .
3124	cook	visited	writer							1	1	2	2	4	4	The cook visited the writer to learn writing from him .
3134	manager	fired	librarian							1	1	2	2	4	4	The manager fired the librarian because he always complained about his work .
3136	driver	transported	counselor							1	1	2	2	4	4	The driver transported the counselor to the hospital because he asked .
3140	mechanic	hired	assistant							1	1	2	2	4	4	The mechanic hired the assistant because she needed help .
3146	writer	met	worker							1	1	3	3	6	6	The writer never met the construction worker and did not want to meet her .
3160	physician	asked	receptionist							1	1	2	2	4	4	The physician asked the receptionist about the booking price and thanked him .
3162	analyst	asked	secretary							1	1	2	2	4	4	The analyst asked the secretary to book a flight and thank him for the help .
3176	farmer	asked	designer							1	1	2	2	4	4	The farmer asked the designer what he was working on .
3178	teacher	told	guard							1	1	2	2	4	4	The teacher told the guard about the danger and was subsequently protected by him .
3180	manager	fired	baker							1	1	2	2	4	4	The manager fired the baker because she was upset .
3194	janitor	reprimanded	accountant							1	1	2	2	4	4	The janitor reprimanded the accountant because she got less allowance .
3198	physician	hired	secretary							1	1	2	2	4	4	The physician hired the secretary because she was highly recommended .
3200	counselor	called	analyst							1	1	2	2	4	4	The counselor called the analyst and asked her about the next appointment .
3206	veterinarian	informed	owner							1	1	2	2	4	4	The veterinarian informed the owner that their cat had developed diabetes .
3214	manager	told	receptionist							1	1	2	2	4	4	The manager told the receptionist that he needed some help with the ceremony .
3216	secretary	hated	developer							1	1	2	2	4	4	The secretary hated the developer and was rude to her .
3224	instructor	encouraged	student							1	1	2	2	4	4	The instructor encouraged the student to attend her help sessions .
3230	driver	took	editor							1	1	2	2	4	4	The driver took the editor on a ride because he wanted to show off the city .
3244	hairdresser	called	carpenter							1	1	2	2	4	4	The hairdresser called the carpenter and then asked her for help .
3250	sheriff	asked	secretary							1	1	2	2	4	4	The sheriff asked the secretary to close the window because she was nearby .
3254	tailor	stopped	guard							1	1	2	2	4	4	The tailor stopped the guard and showed her identification .
3256	laborer	kicked	cashier							1	1	2	2	4	4	The laborer kicked the cashier because he was drunk .
3260	supervisor	provided	writer							1	1	2	2	4	4	The supervisor provided the writer with new tools but she did not appreciate it .
3266	supervisor	asked	baker							1	1	2	2	4	4	The supervisor asked the baker to prepare cakes because he is famous for them .
3278	driver	needed	nurse							1	1	2	2	4	4	The driver needed the nurse to perform an examination and asked him .
3286	supervisor	asked	assistant							1	1	2	2	4	4	The supervisor asked the assistant to get her agreement .
3298	accountant	asked	driver							1	1	2	2	4	4	The accountant asked the driver to stop at the corner and gave her some tips .
3300	supervisor	called	counselor							1	1	2	2	4	4	The supervisor called the counselor because he is an expert on the law .
3312	housekeeper	stopped	carpenter							1	1	2	2	4	4	The housekeeper stopped the carpenter and helped him .
3316	nurse	saw	physician							1	1	2	2	4	4	The nurse saw the physician and asked her to take a look at the patient .
3320	librarian	helped	CEO							1	1	2	2	4	4	The librarian helped the CEO to find the book because it is her job .
3330	sheriff	asked	nurse							1	1	2	2	4	4	The sheriff asked the nurse to go together because he needs help to deal with the accident .
3332	lawyer	needed	librarian							1	1	2	2	4	4	The lawyer needed the librarian to find a book because she knows how the library is organized .
3342	developer	asked	clerk							1	1	2	2	4	4	The developer asked the clerk to prepare the paperwork because she did not know how the system works .
3352	supervisor	invited	designer							1	1	2	2	4	4	The supervisor invited the designer to the party because he made big contributions .
3356	analyst	met	tailor							1	1	2	2	4	4	The analyst met the tailor at home and asked her to make a new suit .
3358	carpenter	helped	housekeeper							1	1	2	2	4	4	The carpenter helped the housekeeper to fix the window as she knew nothing about those tools .
3360	lawyer	respected	housekeeper							1	1	2	2	4	4	The lawyer respected the housekeeper because she was a hardworking person .
3374	worker	asked	nurse							2	2	3	3	5	5	The construction worker asked the nurse for an examination because he was injured .
3376	driver	recognized	receptionist							1	1	2	2	4	4	The driver recognized the receptionist and introduced the boss to him .
3376	driver	introduced	boss							1	1	6	6	8	8	The driver recognized the receptionist and introduced the boss to him .
