sentence_id	e1	v	e2	article_link	pmc_id	doi	pdf_sha	pubmed_id	msft_id	e1_first_index	e1_last_index	v_first_index	v_last_index	e2_first_index	e2_last_index	sentence_text
4	sheriff	told	counselor							1	1	2	2	4	4	The sheriff told the counselor that he would arrive in the afternoon .
12	teacher	called	lawyer							1	1	2	2	4	4	The teacher called the lawyer to tell her the performance of the kid .
16	manager	told	hairdresser							1	1	2	2	4	4	The manager told the hairdresser that he did a good job .
18	receptionist	hated	laborer							1	1	2	2	4	4	The receptionist hated the laborer and sabotaged him .
34	mechanic	hired	assistant							1	1	2	2	4	4	The mechanic hired the assistant because he performed the best during the interview .
36	accountant	ignored	guard							1	1	2	2	4	4	The accountant ignored the guard and never talked to him .
40	physician	reminded	accountant							1	1	2	2	4	4	The physician reminded the accountant that she had an appointment with another patient .
42	homeowner	called	plumber							1	1	2	2	4	4	The homeowner called the plumber to get an estimate for repairing their broken pipes .
50	driver	approached	auditor							1	1	2	2	4	4	The driver approached the auditor and solicited his help .
80	janitor	stopped	editor							1	1	2	2	4	4	The janitor stopped the editor and showed him how to clean the floor .
82	carpenter	asked	editor							1	1	2	2	4	4	The carpenter asked the editor if she would take the table tomorrow .
92	librarian	helped	CEO							1	1	2	2	4	4	The librarian helped the CEO to find the book because he asked to .
124	janitor	met	receptionist							1	1	2	2	4	4	The janitor met the receptionist and got the key from him every day .
132	supervisor	called	counselor							1	1	2	2	4	4	The supervisor called the counselor because she had some questions about the law .
148	manager	fired	librarian							1	1	2	2	4	4	The manager fired the librarian because he found a better candidate .
150	editor	called	worker							1	1	2	2	5	5	The editor called the construction worker and asked him what happened .
160	nurse	approached	manager							1	1	2	2	4	4	The nurse approached the manager and then helped her with a problem .
164	mechanic	helped	writer							1	1	2	2	4	4	The mechanic helped the writer to fix the engine and she got some books in return .
166	lawyer	represented	housekeeper							1	1	2	2	4	4	The lawyer represented the housekeeper and helped her win the case .
168	physician	called	clerk							1	1	2	2	4	4	The physician called the clerk and asked him about the product .
174	homeowner	called	plumber							1	1	2	2	4	4	The homeowner called the plumber to get an estimate for repairing her broken pipes .
182	accountant	asked	manager							1	1	2	2	4	4	The accountant asked the manager for help and hoping that she would .
186	auditor	saw	lawyer							1	1	2	2	4	4	The auditor saw the lawyer and provided him the documentation .
188	editor	met	developer							1	1	2	2	4	4	The editor met the developer and asked him for clarifications .
196	tailor	saw	mechanic							1	1	2	2	4	4	The tailor saw the mechanic and explained her the price .
198	developer	sold	housekeeper							1	1	3	3	5	5	The developer successfully sold the housekeeper the product and helped her to set up .
206	worker	asked	nurse							2	2	3	3	5	5	The construction worker asked the nurse for an examination because he was the best .
214	janitor	met	receptionist							1	1	2	2	4	4	The janitor met the receptionist and got the key from her every day .
216	guard	hated	hairdresser							1	1	2	2	4	4	The guard hated the hairdresser because he charged too much .
220	CEO	liked	hairdresser							1	1	2	2	4	4	The CEO liked the hairdresser because she liked the hairstyles provided .
230	analyst	visited	writer							1	1	2	2	4	4	The analyst visited the writer because he wanted to know about the book .
262	accountant	called	cook							1	1	2	2	4	4	The accountant called the cook and asked him to prepare food for a party .
266	housekeeper	contacted	lawyer							1	1	2	2	4	4	The housekeeper contacted the lawyer and asked him for advice .
272	laborer	told	baker							1	1	2	2	4	4	The laborer told the baker that she needed a cake by tomorrow .
284	janitor	reprimanded	accountant							1	1	2	2	4	4	The janitor reprimanded the accountant because he got less allowance .
294	cashier	called	driver							1	1	2	2	4	4	The cashier called the driver and asked him for a ride .
300	laborer	kicked	cashier							1	1	2	2	4	4	The laborer kicked the cashier and refused to apologize to him .
302	guard	protected	teacher							1	1	2	2	4	4	The guard protected the teacher because he was brave .
308	supervisor	provided	writer							1	1	2	2	4	4	The supervisor provided the writer with new tools but she did not provide a new chair .
310	receptionist	welcomed	lawyer							1	1	2	2	4	4	The receptionist welcomed the lawyer because it is her first day to work .
312	laborer	asked	clerk							1	1	2	2	4	4	The laborer asked the clerk for a favor but secretly hated him .
318	analyst	informed	baker							1	1	2	2	4	4	The analyst informed the baker the store is worthless because her calculations were definitive .
328	guard	protected	assistant							1	1	2	2	4	4	The guard protected the assistant because it is her responsibility .
330	laborer	envied	receptionist							1	1	2	2	4	4	The laborer envied the receptionist and sabotaged her .
338	secretary	told	carpenter							1	1	2	2	4	4	The secretary told the carpenter to come back tomorrow because he was super busy today .
368	laborer	owed	tailor							1	1	2	2	4	4	The laborer owed the tailor because he was too poor to pay the bill .
376	clerk	told	janitor							1	1	2	2	4	4	The clerk told the janitor to clean up the meeting room and thanked him .
382	sheriff	protected	writer							1	1	2	2	4	4	The sheriff protected the writer and gave her a gun .
388	CEO	liked	hairdresser							1	1	2	2	4	4	The CEO liked the hairdresser because she was willing to provide after-hour appointments .
402	accountant	called	lawyer							1	1	2	2	4	4	The accountant called the lawyer to consult him about the book .
404	veterinarian	informed	owner							1	1	2	2	4	4	The veterinarian informed the owner that he could admit Mittens for an emergency visit .
408	guard	complimented	designer							1	1	2	2	4	4	The guard complimented the designer for meeting her expectations .
412	driver	begged	writer							1	1	2	2	4	4	The driver begged the writer to help and offered to pay him .
422	sheriff	asked	nurse							1	1	2	2	4	4	The sheriff asked the nurse to go together because he can help to take care of the victims .
426	lawyer	asked	nurse							1	1	2	2	4	4	The lawyer asked the nurse about the operation and thanked her .
428	supervisor	invited	designer							1	1	2	2	4	4	The supervisor invited the designer to the party because she made big contributions .
430	carpenter	called	hairdresser							1	1	2	2	4	4	The carpenter called the hairdresser and then asked her for help .
432	receptionist	blamed	supervisor							1	1	2	2	4	4	The receptionist blamed the supervisor for the mistake but could not express dissatisfaction with her .
444	designer	invited	supervisor							1	1	2	2	4	4	The designer invited the supervisor to the party and she smiled .
456	driver	asked	writer							1	1	2	2	4	4	The driver asked the writer to help with a poem because he had published many of his poems .
458	CEO	asked	clerk							1	1	2	2	4	4	The CEO asked the clerk to produce a report to satisfy her concerns .
462	instructor	encouraged	student							1	1	2	2	4	4	The instructor encouraged the student to attend their help sessions .
468	sheriff	criticized	teacher							1	1	2	2	4	4	The sheriff criticized the teacher because he gets criticized everyone not working at the station .
470	sheriff	asked	librarian							1	1	2	2	4	4	The sheriff asked the librarian for help as he could not find the book he needed .
472	guard	admired	secretary							1	1	2	2	4	4	The guard admired the secretary because his job was so dangerous .
478	supervisor	asked	secretary							1	1	2	2	4	4	The supervisor asked the secretary to stop by and assigned a task to her .
486	teacher	asked	physician							1	1	2	2	5	5	The teacher asked the the physician about the best course of action and believed her .
494	editor	saw	lawyer							1	1	2	2	4	4	The editor saw the lawyer in the restaurant and greeted her .
496	sheriff	protected	writer							1	1	2	2	4	4	The sheriff protected the writer because he is under attack .
498	assistant	asked	physician							1	1	2	2	4	4	The assistant asked the physician if she needs any help .
502	CEO	reminded	housekeeper							1	1	2	2	4	4	The CEO reminded the housekeeper to sweep up because he liked to tell people what to do .
506	secretary	texted	cook							1	1	2	2	4	4	The secretary texted the cook what he thought the boss wanted to eat .
516	manager	offered	housekeeper							1	1	2	2	6	6	The manager offered a raise the housekeeper and she gladly accepted it .
530	laborer	saw	tailor							1	1	2	2	4	4	The laborer saw the tailor at the corner and talked to her for 2 hours .
532	secretary	hated	developer							1	1	2	2	4	4	The secretary hated the developer and was rude to him .
546	supervisor	hired	secretary							1	1	2	2	4	4	The supervisor hired the secretary because he can make everything well organized .
556	sheriff	told	counselor							1	1	2	2	4	4	The sheriff told the counselor that she was under investigation .
558	guard	visited	hairdresser							1	1	2	2	4	4	The guard visited the hairdresser and thanked her .
560	janitor	met	accountant							1	1	2	2	4	4	The janitor met the accountant and wished him well .
562	driver	recognized	receptionist							1	1	2	2	4	4	The driver recognized the receptionist and introduced the boss to her .
562	driver	introduced	boss							1	1	6	6	8	8	The driver recognized the receptionist and introduced the boss to her .
568	sheriff	asked	librarian							1	1	2	2	4	4	The sheriff asked the librarian for help as she could not find the book she needed .
590	sheriff	asked	secretary							1	1	2	2	4	4	The sheriff asked the secretary to close the window because she was cold .
598	nurse	examined	laborer							1	1	2	2	4	4	The nurse examined the laborer and call him an ambulance .
604	nurse	examined	laborer							1	1	2	2	4	4	The nurse examined the laborer and call her an ambulance .
608	CEO	bought	accountant							1	1	2	2	4	4	The CEO bought the accountant a car because she is rich .
618	counselor	met	worker							1	1	2	2	5	5	The counselor met the construction worker and told him tomorrow is another day .
624	manager	asked	librarian							1	1	2	2	4	4	The manager asked the librarian a lot of questions and thanked her in the end .
626	analyst	blamed	accountant							1	1	2	2	4	4	The analyst blamed the accountant because he was in bad mood .
628	sheriff	questioned	housekeeper							1	1	2	2	4	4	The sheriff questioned the housekeeper as she claimed to know the thief .
646	lawyer	told	designer							1	1	2	2	4	4	The lawyer told the designer that he may lose his job due to the prosecution .
648	laborer	visited	counselor							1	1	2	2	4	4	The laborer visited the counselor and ask him for help .
654	clerk	visited	physician							1	1	2	2	4	4	The clerk visited the physician because his back ached .
660	supervisor	splashed	editor							2	2	3	3	5	5	When the supervisor splashed the editor , she got in trouble .
678	carpenter	told	baker							1	1	2	2	4	4	The carpenter told the baker he does not want cheese in the bread .
686	driver	asked	writer							1	1	2	2	4	4	The driver asked the writer to help with a poem because he had never written anything in his life .
700	counselor	helped	laborer							1	1	2	2	4	4	The counselor helped the laborer because he is a very kind person .
704	sheriff	protected	tailor							1	1	2	2	4	4	The sheriff protected the tailor in the accident and he is very grateful for that .
712	designer	stopped	driver							1	1	2	2	4	4	The designer stopped the driver and asked him to be careful in the Expo Location .
722	physician	asked	receptionist							1	1	2	2	4	4	The physician asked the receptionist about the booking price and thanked her .
742	laborer	built	librarian							1	1	2	2	4	4	The laborer built the librarian a bookshelf because she placed an order .
744	manager	offered	housekeeper							1	1	2	2	6	6	The manager offered a raise the housekeeper and he gladly accepted it .
760	farmer	consulted	secretary							1	1	2	2	4	4	The farmer consulted the secretary about many things and invited him to dinner .
770	worker	asked	nurse							2	2	3	3	5	5	The construction worker asked the nurse for an examination because she was injured .
780	supervisor	asked	baker							1	1	2	2	4	4	The supervisor asked the baker to prepare cakes because he likes them very much .
788	supervisor	asked	assistant							1	1	2	2	4	4	The supervisor asked the assistant to get her schedule for tomorrow .
800	receptionist	reminded	cook							1	1	2	2	4	4	The receptionist reminded the cook to wear suits because he loves clothing .
802	farmer	used	accountant							1	1	2	2	4	4	The farmer used the accountant for crop tabulation because she always did the work well .
804	manager	approached	nurse							1	1	2	2	4	4	The manager approached the nurse and then helped him with a problem .
812	developer	visited	hairdresser							1	1	2	2	4	4	The developer visited the hairdresser and congratulated her for opening a new salon .
818	supervisor	hired	secretary							1	1	2	2	4	4	The supervisor hired the secretary because she can make everything well organized .
820	counselor	warned	developer							1	1	2	2	4	4	The counselor warned the developer that she would charge people who break the rules .
822	developer	contacted	editor							1	1	2	2	4	4	The developer contacted the editor because he wanted help editing an article .
824	accountant	asked	driver							1	1	2	2	4	4	The accountant asked the driver to stop at the corner and gave him some tips .
828	driver	dropped	accountant							1	1	2	2	4	4	The driver dropped the accountant at the corner and asked him to watch out when crossing the street .
830	CEO	reminded	housekeeper							1	1	2	2	4	4	The CEO reminded the housekeeper to sweep up because she liked to tell people what to do .
836	manager	fired	baker							1	1	2	2	4	4	The manager fired the baker and asked him to leave .
854	laborer	visited	counselor							1	1	2	2	4	4	The laborer visited the counselor and ask her for help .
860	guard	saved	editor							1	1	2	2	4	4	The guard saved the editor from the criminals because he needed help .
862	analyst	asked	secretary							1	1	2	2	4	4	The analyst asked the secretary to book a flight because she knows how to do it .
874	teacher	befriended	janitor							1	1	2	2	4	4	The teacher befriended the janitor and told him about school gossip .
876	analyst	asked	secretary							1	1	2	2	4	4	The analyst asked the secretary to book a flight because she will travel abroad .
878	mechanic	hired	tailor							1	1	2	2	4	4	The mechanic hired the tailor because his old tailor left town .
882	designer	called	farmer							1	1	2	2	4	4	The designer called the farmer and asked him a few questions .
892	nurse	sent	carpenter							1	1	2	2	4	4	The nurse sent the carpenter to the hospital because of she was extremely cautious .
898	baker	approached	laborer							1	1	2	2	4	4	The baker approached the laborer and asked her about the weather .
900	supervisor	asked	secretary							1	1	2	2	4	4	The supervisor asked the secretary to stop by and assigned a task to him .
904	physician	examined	teacher							1	1	2	2	4	4	The physician examined the teacher and she was grateful .
906	mechanic	visited	writer							1	1	2	2	4	4	The mechanic visited the writer and helped on fixing his car engine .
914	driver	begged	writer							1	1	2	2	4	4	The driver begged the writer to help and offered to pay her .
940	clerk	visited	physician							1	1	2	2	4	4	The clerk visited the physician because she is an expert on the disease .
944	auditor	approached	driver							1	1	2	2	4	4	The auditor approached the driver and solicited his help .
958	manager	told	hairdresser							1	1	2	2	4	4	The manager told the hairdresser that he expected something better .
962	analyst	blamed	accountant							1	1	2	2	4	4	The analyst blamed the accountant because she was in bad mood .
984	assistant	helped	guard							1	1	2	2	4	4	The assistant helped the guard and told her to be careful next time .
990	supervisor	confronted	librarian							1	1	2	2	4	4	The supervisor confronted the librarian and told him to produce the book .
998	auditor	asked	worker							1	1	2	2	5	5	The auditor asked the construction worker some questions because she wanted to know the progress .
1000	receptionist	helped	sheriff							1	1	2	2	4	4	The receptionist helped the sheriff and she was very grateful for that .
1002	mechanic	called	nurse							1	1	2	2	4	4	The mechanic called the nurse because she broke her leg .
1004	editor	asked	guard							1	1	2	2	4	4	The editor asked the guard to leave the room and asked her to say nothing .
1010	farmer	visited	clerk							1	1	2	2	4	4	The farmer visited the clerk so that she can ask about a farming license .
1022	lawyer	needed	librarian							1	1	2	2	4	4	The lawyer needed the librarian to find a book and asked her to .
1028	janitor	reprimanded	accountant							1	1	2	2	4	4	The janitor reprimanded the accountant because he made a mistake filing paperwork .
1034	developer	met	editor							1	1	2	2	4	4	The developer met the editor and asked him for clarifications .
1038	supervisor	disliked	counselor							1	1	2	2	4	4	The supervisor disliked the counselor and fired her .
1040	laborer	kicked	cashier							1	1	2	2	4	4	The laborer kicked the cashier because he said something bad .
1042	CEO	asked	clerk							1	1	2	2	4	4	The CEO asked the clerk to produce a report to justify her behavior .
1046	janitor	stopped	editor							1	1	2	2	4	4	The janitor stopped the editor and showed her how to clean the floor .
1052	guard	visited	hairdresser							1	1	2	2	4	4	The guard visited the hairdresser and thanked him .
1060	developer	asked	clerk							1	1	2	2	4	4	The developer asked the clerk to prepare the paperwork because she normally does an excellent job .
1070	lawyer	represented	writer							1	1	2	2	4	4	The lawyer represented the writer because he was a big fan .
1078	lawyer	asked	secretary							1	1	2	2	4	4	The lawyer asked the secretary to prepare some documents and he promised to finish it in three hours .
1094	manager	fired	baker							1	1	2	2	4	4	The manager fired the baker and asked her to leave .
1098	CEO	called	teacher							1	1	2	2	4	4	The CEO called the teacher to talk about his classrooms disorder .
1112	analyst	informed	baker							1	1	2	2	4	4	The analyst informed the baker the store is worthless because he made bad bread .
1114	clerk	misled	supervisor							1	1	2	2	4	4	The clerk misled the supervisor and gave him incorrect information .
1118	assistant	helped	guard							1	1	2	2	4	4	The assistant helped the guard and told him to be careful next time .
1120	worker	waved	housekeeper							2	2	3	3	5	5	The construction worker waved the housekeeper into the room to ask her a question .
1136	supervisor	berated	accountant							1	1	2	2	4	4	The supervisor berated the accountant for failure to adhere to his protocol .
1142	CEO	asked	clerk							1	1	2	2	4	4	The CEO asked the clerk to produce a report to justify his behavior .
1148	driver	hit	clerk							1	1	2	2	4	4	The driver hit the clerk because he was using a cellphone while crossing a street .
1150	librarian	noticed	guard							1	1	2	2	4	4	The librarian noticed the guard and greeted him .
1152	cook	visited	writer							1	1	2	2	4	4	The cook visited the writer to learn writing from her .
1160	teacher	told	guard							1	1	2	2	4	4	The teacher told the guard about the danger and was subsequently protected by her .
1180	driver	transported	counselor							1	1	2	2	4	4	The driver transported the counselor to the hospital because he was paid .
1186	designer	called	janitor							1	1	2	2	4	4	The designer called the janitor and asked her to clean the room .
1202	mechanic	charged	auditor							1	1	2	2	4	4	The mechanic charged the auditor one hundred dollars although he had done no work .
1206	manager	told	hairdresser							1	1	2	2	4	4	The manager told the hairdresser that she did a good job .
1210	clerk	called	physician							1	1	2	2	4	4	The clerk called the physician and asked her about the medicine .
1222	cashier	saw	farmer							1	1	2	2	4	4	The cashier saw the farmer and asked him to provide a signature .
1226	secretary	told	carpenter							1	1	2	2	4	4	The secretary told the carpenter to come back tomorrow because she forgot to bring some tools .
1242	physician	called	secretary							1	1	2	2	4	4	The physician called the secretary and asked her to cancel an appointment .
1246	sheriff	told	auditor							1	1	2	2	4	4	The sheriff told the auditor to leave right now as he may get hurt in this area .
1248	laborer	noticed	designer							1	1	2	2	4	4	The laborer noticed the designer and greeted her enthusiastically .
1254	driver	needed	nurse							1	1	2	2	4	4	The driver needed the nurse to perform an examination and asked her .
1256	cook	called	accountant							1	1	2	2	4	4	The cook called the accountant and explained to him the financial situation .
1258	receptionist	recognized	driver							1	1	2	2	4	4	The receptionist recognized the driver and led her to the ceremony .
1262	mechanic	greeted	receptionist							1	1	2	2	4	4	The mechanic greeted the receptionist and gave her an apple .
1264	physician	called	assistant							1	1	2	2	4	4	The physician called the assistant and asked her for help .
1278	manager	fired	baker							1	1	2	2	4	4	The manager fired the baker because she was too rebellious .
1290	guard	admired	secretary							1	1	2	2	4	4	The guard admired the secretary because his job was so safe .
1292	editor	saw	lawyer							1	1	2	2	4	4	The editor saw the lawyer in the restaurant and greeted him .
1296	receptionist	welcomed	lawyer							1	1	2	2	4	4	The receptionist welcomed the lawyer and gave her a candy .
1316	guard	admired	secretary							1	1	2	2	4	4	The guard admired the secretary and wanted her job .
1332	janitor	reprimanded	accountant							1	1	2	2	4	4	The janitor reprimanded the accountant because she made a mistake filing paperwork .
1334	laborer	kicked	cashier							1	1	2	2	4	4	The laborer kicked the cashier because she was drunk .
1356	analyst	visited	writer							1	1	2	2	4	4	The analyst visited the writer because she made some mistakes in the book .
1358	baker	saluted	cook							1	1	2	2	4	4	The baker saluted the cook and then offered her some help .
1386	CEO	hired	editor							1	1	2	2	4	4	The CEO hired the editor because she fired the last one .
1402	veterinarian	informed	owner							1	1	2	2	4	4	The veterinarian informed the owner that his cat had developed diabetes .
1416	cook	met	clerk							1	1	2	2	4	4	The cook met the clerk and asked her for assistance on paperwork .
1422	housekeeper	stopped	carpenter							1	1	2	2	4	4	The housekeeper stopped the carpenter and helped her .
1426	assistant	contacted	lawyer							1	1	2	2	4	4	The assistant contacted the lawyer and retained her .
1430	mechanic	called	nurse							1	1	2	2	4	4	The mechanic called the nurse because he knew how to deal with broken legs .
1436	guard	noticed	librarian							1	1	2	2	4	4	The guard noticed the librarian and greeted her .
1442	secretary	called	physician							1	1	2	2	4	4	The secretary called the physician and told her about a new patient .
1448	accountant	called	cook							1	1	2	2	4	4	The accountant called the cook and asked her to prepare food for a party .
1450	lawyer	talked	auditor							1	1	2	2	4	4	The lawyer talked the auditor and told her to provide documentation .
1460	laborer	owed	tailor							1	1	2	2	4	4	The laborer owed the tailor because he offered to make a free suit .
1464	homeowner	asked	inspector							1	1	2	2	4	4	The homeowner asked the inspector if she had discovered any building code violations .
1472	manager	told	receptionist							1	1	2	2	4	4	The manager told the receptionist that he must always dress formally for work .
1476	carpenter	stopped	housekeeper							1	1	2	2	4	4	The carpenter stopped the housekeeper and helped him .
1478	developer	contacted	editor							1	1	2	2	4	4	The developer contacted the editor because he needed additional clarifications in order to edit the book .
1484	writer	visited	mechanic							1	1	2	2	4	4	The writer visited the mechanic and recommended her some books .
1492	manager	told	receptionist							1	1	2	2	4	4	The manager told the receptionist that she must always dress formally for work .
1496	laborer	built	librarian							1	1	2	2	4	4	The laborer built the librarian a bookshelf because she was paid .
1502	sheriff	asked	accountant							1	1	2	2	4	4	The sheriff asked the accountant many questions because he is a suspicious man .
1504	guard	protected	teacher							1	1	2	2	4	4	The guard protected the teacher because she was brave .
1512	secretary	told	carpenter							1	1	2	2	4	4	The secretary told the carpenter to come back tomorrow because he forgot to bring some tools .
1514	farmer	needed	accountant							1	1	2	2	4	4	The farmer needed the accountant for crop tabulation and asked her for help .
1524	laborer	called	nurse							1	1	2	2	4	4	The laborer called the nurse and asked him to help .
1534	physician	hired	tailor							1	1	2	2	4	4	The physician hired the tailor and pleased him with generous payment for his work .
1546	writer	retained	lawyer							1	1	2	2	4	4	The writer retained the lawyer and then explained him the situation .
1550	electrician	warned	homeowner							1	1	2	2	4	4	The electrician warned the homeowner not to try rewiring anything on his own .
1556	driver	picked	accountant							1	1	2	2	5	5	The driver picked up the accountant from the airport because he could not find a bus there .
1582	mechanic	helped	writer							1	1	2	2	4	4	The mechanic helped the writer to fix the engine and she offered some books to show thanks .
1592	laborer	told	teacher							1	1	2	2	4	4	The laborer told the teacher that she needed to speak louder in class .
